{
  "Manufacturer":{"Locale":"en-US","Text":"Open Industry 4.0 Alliance Community"},
  "ManufacturerUri":"openindustry4.com",
  "Model":{"Locale":"en-US","Text":"OEC Registry"},
  "ProductCode":"OEC-REG",
  "HardwareRevision":"",
  "SoftwareRevision":"1.1.0.0",
  "DeviceRevision":"1.1.0.0",
  "DeviceManual":"https://openindustry4.com/fileadmin/Dateien/Downloads/2019_11_20_OI4_Whitepaper_General.pdf",
  "DeviceClass":"OI4.Registry",
  "SerialNumber":"OEC-Registry",
  "ProductInstanceUri":"oi4/appid/service",
  "RevisionCounter":0,
  "Description":
  {
    "Locale":"en-US",
    "Text":"The OEC Registry, an Open Industry 4.0 Alliance application"
  }
}
